{
  "schema_version": "kb-pack-request/v2",
  "request_id": "req-20260313-perf-exp-003",
  "created_at": "2026-03-13T13:03:00Z",
  "intent": "model_expectation",
  "repo_root": ".",
  "resolve_policy": "auto",
  "logical_domains": [
    "validation_evidence",
    "deployment_config",
    "ascend_foundation"
  ],
  "physical_shard_hints": [
    "validation",
    "repo_semantics",
    "hw_runtime_caps"
  ],
  "selectors": {
    "files": [],
    "symbols": [],
    "entities": [
      "baseline.expectation.qwen3-next-32b.a2",
      "repo.policy.prefill"
    ],
    "errors": [],
    "models": [
      "qwen3-next-32b"
    ],
    "features": [
      "prefill",
      "decode",
      "tp4",
      "bf16",
      "ctx8k"
    ],
    "hw": [
      "A2"
    ],
    "commits": [],
    "prs": [],
    "versions": [
      "vllm-ascend@0.13.0"
    ],
    "configs": [
      "tp4_bf16_ctx8k"
    ]
  },
  "must_have": [
    "expected TTFT range",
    "expected throughput range",
    "memory headroom assumptions"
  ],
  "nice_to_have": [
    "closest comparable baseline",
    "top sensitivity factors"
  ],
  "evidence_refs": [],
  "budget_token_cap": 1500,
  "max_atoms": 10,
  "max_hops": 1,
  "include_evidence_stubs": true,
  "stop_after_first_sufficient": true,
  "emit_path": ".agents/kb/local/capsules/perf-exp-003.json"
}
